{"$schema":"https://json-schema.org/draft/2020-12/schema","$id":"https://example.invalid/mojoattention/agent-authority.schema.json","title":"Provider-neutral agent authority manifest","type":"object","additionalProperties":false,"required":["schema_version","default","protected_paths","roles"],"properties":{"schema_version":{"const":"1.0.0"},"default":{"const":"deny"},"protected_paths":{"$ref":"#/$defs/paths"},"roles":{"type":"array","minItems":9,"items":{"$ref":"#/$defs/role"}}},"$defs":{"paths":{"type":"array","items":{"type":"string","minLength":1},"uniqueItems":true},"role":{"type":"object","additionalProperties":false,"required":["id","read_paths","write_paths","indirect_output_paths","deliverables","mandatory_stops","can_approve_protected_changes","can_approve_final_merge"],"properties":{"id":{"type":"string","pattern":"^[a-z]+(?:-[a-z]+)*$"},"read_paths":{"$ref":"#/$defs/paths"},"write_paths":{"$ref":"#/$defs/paths"},"indirect_output_paths":{"$ref":"#/$defs/paths"},"deliverables":{"type":"array","items":{"type":"string","minLength":1},"minItems":1,"uniqueItems":true},"mandatory_stops":{"type":"array","items":{"enum":["scope-broadening","validation-weakening","role-boundary-crossing","unauthorized-protected-change","self-approval","final-merge-approval"]},"minItems":6,"uniqueItems":true},"can_approve_protected_changes":{"const":false},"can_approve_final_merge":{"const":false}}}}}
