{"schema_version":"1.0.0","default":"deny","protected_paths":["contracts/agent-authority.json","schemas/agent-authority.schema.json","src/mojoattention/validation/authority.py","src/mojoattention/validation/privacy.py","scripts/quality.sh",".github/workflows/foundation-quality.yml","uv.lock"],"roles":[
{"id":"orchestrator","read_paths":["README.md","contracts","schemas","src","scripts","tests","docs"],"write_paths":[],"indirect_output_paths":[],"deliverables":["coordination record"],"mandatory_stops":["scope-broadening","validation-weakening","role-boundary-crossing","unauthorized-protected-change","self-approval","final-merge-approval"],"can_approve_protected_changes":false,"can_approve_final_merge":false},
{"id":"explorer","read_paths":["README.md","contracts","schemas","src","scripts","tests","docs"],"write_paths":[],"indirect_output_paths":[],"deliverables":["repository findings"],"mandatory_stops":["scope-broadening","validation-weakening","role-boundary-crossing","unauthorized-protected-change","self-approval","final-merge-approval"],"can_approve_protected_changes":false,"can_approve_final_merge":false},
{"id":"acceptance-auditor","read_paths":["README.md","contracts","schemas","src","scripts","tests","docs"],"write_paths":[],"indirect_output_paths":[],"deliverables":["acceptance findings"],"mandatory_stops":["scope-broadening","validation-weakening","role-boundary-crossing","unauthorized-protected-change","self-approval","final-merge-approval"],"can_approve_protected_changes":false,"can_approve_final_merge":false},
{"id":"implementer","read_paths":["README.md","src","scripts"],"write_paths":["src","scripts"],"indirect_output_paths":[],"deliverables":["implementation patch"],"mandatory_stops":["scope-broadening","validation-weakening","role-boundary-crossing","unauthorized-protected-change","self-approval","final-merge-approval"],"can_approve_protected_changes":false,"can_approve_final_merge":false},
{"id":"test-builder","read_paths":["src"],"write_paths":["tests","fixtures"],"indirect_output_paths":[],"deliverables":["test patch"],"mandatory_stops":["scope-broadening","validation-weakening","role-boundary-crossing","unauthorized-protected-change","self-approval","final-merge-approval"],"can_approve_protected_changes":false,"can_approve_final_merge":false},
{"id":"validation-triage","read_paths":["reports"],"write_paths":[],"indirect_output_paths":[],"deliverables":["validation diagnosis"],"mandatory_stops":["scope-broadening","validation-weakening","role-boundary-crossing","unauthorized-protected-change","self-approval","final-merge-approval"],"can_approve_protected_changes":false,"can_approve_final_merge":false},
{"id":"performance-analyst","read_paths":["reports"],"write_paths":[],"indirect_output_paths":[],"deliverables":["performance analysis"],"mandatory_stops":["scope-broadening","validation-weakening","role-boundary-crossing","unauthorized-protected-change","self-approval","final-merge-approval"],"can_approve_protected_changes":false,"can_approve_final_merge":false},
{"id":"documentation-agent","read_paths":["src"],"write_paths":["docs"],"indirect_output_paths":[],"deliverables":["documentation patch"],"mandatory_stops":["scope-broadening","validation-weakening","role-boundary-crossing","unauthorized-protected-change","self-approval","final-merge-approval"],"can_approve_protected_changes":false,"can_approve_final_merge":false}]}
